,College Name,360 Careers Rating,NIRF Rank
4,Indian Institute of Technology Madras,AAAAA,1
1,Indian Institute of Technology Delhi,AAAAA,2
0,Indian Institute of Technology Bombay,AAAAA,3
3,Indian Institute of Technology Kharagpur,AAAAA,4
2,Indian Institute of Technology Kanpur,AAAAA,5
5,Indian Institute of Technology Roorkee,AAAAA,6
63,Indian Institute of Technology Guwahati,AAAA,7
18,Indian Institute of Technology Hyderabad,AAAA+,8
43,"Anna University, Chennai",AAAA,9
34,National Institute of Technology Tiruchirappalli,AAAA+,10
15,Indian Institute of Technology Banaras Hindu University Varanasi,AAAA+,11
25,"Institute of Chemical Technology, Mumbai",AAAA+,12
20,Indian Institute of Technology Indore,AAAA+,13
27,"Jadavpur University, Kolkata",AAAA+,14
19,Indian Institute of Technology Indian School of Mines Dhanbad,AAAA+,15
88,National Institute of Technology Rourkela,AAAA,16
16,Indian Institute of Technology Bhubaneswar,AAAA+,17
111,"Vellore Institute of Technology, Vellore",AAAA,18
11,Indian Institute of Engineering Science and Technology Shibpur,AAAA+,19
21,Indian Institute of Technology Mandi,AAAA+,20
33,National Institute of Technology Karnataka Surathkal,AAAA+,21
22,Indian Institute of Technology Patna,AAAA+,22
39,"Thapar Institute of Engineering and Technology, Patiala",AAAA+,23
17,Indian Institute of Technology Gandhinagar,AAAA+,24
6,"Birla Institute of Technology and Science, Pilani",AAAA+,25
35,National Institute of Technology Warangal,AAAA+,26
28,"Jamia Millia Islamia, New Delhi",AAAA+,27
31,National Institute of Technology Calicut,AAAA+,28
23,Indian Institute of Technology Ropar,AAAA+,29
14,"Indian Institute of Space Science and Technology, Thiruvananthapuram",AAAA+,30
41,Visvesvaraya National Institute of Technology Nagpur,AAAA+,31
157,"Siksha 'O' Anusandhan, Bhubaneswar",AAA+,32
49,"Birla Institute of Technology, Mesra",AAAA,33
8,"Delhi Technological University, Delhi",AAAA+,34
96,"SRM Institute of Science and Technology, Chennai",AAAA,36
106,"Sri Sivasubramaniya Nadar College of Engineering, Kalavakkam",AAAA,37
101,"Shanmugha Arts Science Technology Research and Academy, Thanjavur",AAAA,38
26,"International Institute of Information Technology, Hyderabad",AAAA+,39
30,Motilal Nehru National Institute of Technology Allahabad Prayagraj,AAAA+,42
77,"Manipal Institute of Technology, Manipal",AAAA,43
93,"PSG College of Technology, Coimbatore",AAAA,44
82,National Institute of Technology Durgapur,AAAA,46
100,"Sathyabama Institute of Science and Technology, Chennai",AAAA,47
72,"Kalinga Institute of Industrial Technology, Bhubaneswar",AAAA,48
64,Indian Institute of Technology Jodhpur,AAAA,50
89,National Institute of Technology Silchar,AAAA,51
74,"Koneru Lakshmaiah Education Foundation, Guntur",AAAA,52
29,Malaviya National Institute of Technology Jaipur,AAAA+,53
24,"Indraprastha Institute of Information Technology, Delhi",AAAA+,55
108,"Thiagarajar College of Engineering, Madurai",AAAA,56
38,Sardar Vallabhbhai National Institute of Technology Surat,AAAA+,58
42,"Andhra University College of Engineering, Visakhapatnam",AAAA,59
84,National Institute of Technology Hamirpur,AAAA,60
71,"Kalasalingam Academy of Research and Education, Virudhunagar",AAAA,61
79,Maulana Azad National Institute of Technology Bhopal,AAAA,62
37,"RV College of Engineering, Bangalore",AAAA+,63
95,"Ramaiah Institute of Technology, Bangalore",AAAA,64
85,National Institute of Technology Meghalaya,AAAA,67
53,"Coimbatore Institute of Technology, Coimbatore",AAAA,68
46,"BMS College of Engineering, Bangalore",AAAA,69
81,National Institute of Technology Agartala,AAAA,70
7,"College of Engineering, Pune",AAAA+,71
73,"Karunya Institute of Technology and Sciences, Coimbatore",AAAA,72
60,"Guru Gobind Singh Indraprastha University, Delhi",AAAA,73
87,National Institute of Technology Raipur,AAAA,74
13,Indian Institute of Information Technology Design and Manufacturing Jabalpur,AAAA+,75
94,"Pondicherry Engineering College, Puducherry",AAAA,76
75,"Kumaraguru College of Technology, Coimbatore",AAAA,77
36,"Punjab Engineering College, Chandigarh",AAAA+,78
103,"Siddaganga Institute of Technology, Tumkur",AAAA,79
69,"Jaypee Institute of Information Technology, Noida",AAAA,80
45,Atal Bihari Vajpayee Indian Institute of Information Technology and Management Gwalior,AAAA,81
12,Indian Institute of Information Technology Allahabad,AAAA+,82
54,"Dayalbagh Educational Institute, Agra",AAAA,84
102,"Shri Mata Vaishno Devi University, Katra",AAAA,85
168,"Vel Tech Rangarajan Dr Sagunthala R and D Institute of Science and Technology, Chennai",AAA+,86
83,National Institute of Technology Goa,AAAA,87
141,"Mepco Schlenk Engineering College, Sivakasi",AAA+,88
163,"Sri Venkateswara University, Tirupati",AAA+,89
59,"Government College of Technology, Coimbatore",AAAA,90
56,"Dhirubhai Ambani Institute of Information and Communication Technology, Gandhinagar",AAAA,91
44,"Army Institute of Technology, Pune",AAAA,91
48,"Bharati Vidyapeeth Deemed University College of Engineering, Pune",AAAA,93
173,"CV Raman College of Engineering, Bhubaneswar",AAA,94
61,"Hindustan Institute of Technology and Science, Chennai",AAAA,95
131,"IK Gujral Punjab Technical University, Jalandhar",AAA+,96
104,"Sri Krishna College of Engineering and Technology, Coimbatore",AAAA,97
47,"Bannari Amman Institute of Technology, Erode",AAAA,98
137,"Kongu Engineering College, Erode",AAA+,99
51,"Chaitanya Bharathi Institute of Technology, Hyderabad",AAAA,100
158,"Sona College of Technology, Salem",AAA+,101
65,"Institute of Engineering and Management, Kolkata",AAAA,101
68,"Jawaharlal Nehru Technological University College of Engineering, Kakinada",AAAA,103
10,"Graphic Era University, Dehradun",AAAA+,104
40,"Veermata Jijabai Technological Institute, Mumbai",AAAA+,105
90,"New Horizon College of Engineering, Bangalore",AAAA,106
112,"Vignan's Foundation for Science Technology and Research, Guntur",AAAA,107
181,"Tamil Nadu Veterinary and Animal Sciences University, Chennai",AAA,108
80,"Narsee Monjee Institute of Management Studies, Mumbai",AAAA,110
127,"GH Raisoni College of Engineering, Nagpur",AAA+,111
155,"Shri Ramdeobaba College of Engineering and Management, Nagpur",AAA+,112
9,Dr B R Ambedkar National Institute of Technology Jalandhar,AAAA+,113
99,"Sardar Patel Institute of Technology, Mumbai",AAAA,114
165,"The NorthCap University, Gurgaon",AAA+,117
52,"Chandigarh University, Chandigarh",AAAA,117
144,"National Institute of Food Technology Entrepreneurship and Management, Sonepat",AAA+,117
67,"JSS Science and Technology University, Mysuru",AAAA,120
70,"Jaypee University of Information Technology, Solan",AAAA,121
153,"Rashtrasant Tukadoji Maharaj Nagpur University, Nagpur",AAA+,122
105,"Sri Sai Ram Engineering College, Chennai",AAAA,123
178,"Saveetha Engineering College, Chennai",AAA,124
138,"Lovely Professional University, Phagwara",AAA+,125
167,"Veer Surendra Sai University of Technology, Sambalpur",AAA+,126
55,"Dayananda Sagar College of Engineering, Bangalore",AAAA,127
142,"NMAM Institute of Technology, Karkala Taluk",AAA+,128
164,"St Joseph's College of Engineering, Chennai",AAA+,128
32,National Institute of Technology Jamshedpur,AAAA+,130
117,"BS Abdur Rahman Institute of Science and Technology, Chennai",AAA+,131
50,"CVR College of Engineering, Hyderabad",AAAA,132
98,"Sant Longowal Institute of Engineering and Technology, Longowal",AAAA,133
86,National Institute of Technology Patna,AAAA,134
172,"Yeshwantrao Chavan College of Engineering, Nagpur",AAA+,134
91,"Nirma University, Ahmedabad",AAAA,136
76,"Maharaja Sayajirao University of Baroda, Vadodara",AAAA,137
160,"Sri Ramakrishna Engineering College, Coimbatore",AAA+,138
152,"Rajalakshmi Engineering College, Chennai",AAA+,139
133,"Institute of Aeronautical Engineering, Dundigal",AAA+,139
146,"Nitte Meenakshi Institute of Technology, Bangalore",AAA+,142
162,"Sri Venkateswara College of Engineering, Sriperumbudur",AAA+,143
171,"YMCA University of Science and Technology, Faridabad",AAA+,144
109,"University of Petroleum and Energy Studies, Dehradun",AAAA,145
179,"Sri Krishna College of Technology, Coimbatore",AAA,145
119,"BVRIT Hyderabad College of Engineering for Women, Hyderabad",AAA+,147
145,National Institute of Technology Manipur,AAA+,148
148,"PES University, Bangalore",AAA+,149
130,"Heritage Institute of Technology, Kolkata",AAA+,150
149,"PSNA College of Engineering and Technology, Dindigul",AAA+,150
166,"Vardhaman College of Engineering, Hyderabad",AAA+,152
113,"Walchand College of Engineering, Sangli",AAAA,153
57,"Dr Vishwanath Karad MIT World Peace University, Pune",AAAA,154
170,"Vishwakarma Institute of Technology, Pune",AAA+,155
116,"BNM Institute of Technology, Bangalore",AAA+,156
115,"BMS Institute of Technology and Management, Bangalore",AAA+,157
151,"RMK Engineering College, Thiruvallur",AAA+,157
135,"KLE Technological University, Hubballi",AAA+,159
143,"Narula Institute of Technology, Agarpara",AAA+,160
147,"PES College of Engineering, Mandya",AAA+,161
132,"Indira Gandhi Delhi Technical University for Women, Delhi",AAA+,162
122,"Dr Ambedkar Institute of Technology, Bangalore",AAA+,163
140,"Manav Rachna International Institute of Research and Studies, Faridabad",AAA+,164
78,"Maulana Abul Kalam Azad University of Technology, Kolkata",AAAA,165
176,"National Engineering College, Kovilpatti",AAA,166
159,"Sree Vidyanikethan Engineering College, Tirupati",AAA+,167
118,"BV Raju Institute of Technology, Narsapur",AAA+,168
114,"Anurag Group of Institutions, Ghatkesar",AAA+,169
110,"Vasavi College of Engineering, Hyderabad",AAAA,170
169,"Velagapudi Ramakrishna Siddhartha Engineering College, Vijayawada",AAA+,171
177,"Ramrao Adik Institute of Technology, Navi Mumbai",AAA,172
92,"North Eastern Regional Institute of Science and Technology, Nirjuli",AAAA,173
129,"Haldia Institute of Technology, Haldia",AAA+,174
121,"CMR Institute of Technology, Bangalore",AAA+,174
180,"Sri Venkateswara College of Engineering and Technology, Chittoor",AAA,176
126,"G Pulla Reddy Engineering College, Kurnool",AAA+,177
107,"The National Institute of Engineering, Mysore",AAAA,178
128,"Gokaraju Rangaraju Institute of Engineering and Technology, Hyderabad",AAA+,179
136,"Kakatiya Institute of Technology and Science, Warangal",AAA+,180
154,"Sardar Patel College of Engineering, Mumbai",AAA+,180
134,"KJ Somaiya College of Engineering, Mumbai",AAA+,182
156,"Shri Vishnu Engineering College for Women, Bhimavaram",AAA+,183
175,"Dr Mahalingam College of Engineering and Technology, Pollachi",AAA,184
66,"JNTUA College of Engineering, Anantapur",AAAA,185
139,"MKSSS's Cummins College of Engineering for Women, Pune",AAA+,188
183,"Vel Tech Multi Tech Dr Rangarajan Dr Sakunthala Engineering College, Chennai",AAA,189
97,"Sagi Ramakrishnam Raju Engineering College, Bhimavaram",AAAA,189
120,"BVV Sangha's Basaveshwar Engineering College, Bagalkot",AAA+,191
150,"Pimpri Chinchwad College of Engineering, Pune",AAA+,192
182,"Thakur College of Engineering and Technology, Mumbai",AAA,193
161,"Sri Sai Ram Institute of Technology, Chennai",AAA+,194
124,"Dwarkadas J Sanghvi College of Engineering, Mumbai",AAA+,195
123,"Dr MGR Educational and Research Institute, Chennai",AAA+,196
62,Indian Institute of Information Technology Design and Manufacturing Kancheepuram,AAAA,197
174,"Dr BR Ambedkar Institute of Technology, Port Blair",AAA,198
58,"Gayatri Vidya Parishad College of Engineering, Visakhapatnam",AAAA,198
125,"Easwari Engineering College, Chennai",AAA+,200
